[
  { "id": "amazon.prime_video", "match": { "description": "PRIME VIDEO|PRIMEVIDEO|AMAZON VIDEO" }, "set": { "payee": "Prime Video", "category_id": "personal.shopping.streaming_service" }, "samples": ["PRIME VIDEO*AB12CD34E", "Amazon Video On Demand"] },
  { "id": "amazon.prime", "match": { "description": "AMAZON PRIME|AMZN PRIME|PRIME MEMBERSHIP" }, "set": { "payee": "Amazon Prime", "category_id": "personal.shopping.membership_fees" }, "samples": ["Amazon Prime*1A2B3C4D5", "Amazon Prime Membership"] },
  { "id": "amazon.kindle", "match": { "description": "KINDLE" }, "set": { "payee": "Kindle", "category_id": "personal.shopping.books" }, "samples": ["Kindle Svcs*AB1CD2EF3", "Amazon Kindle"] },
  { "id": "amazon.audible", "match": { "description": "^AUDIBLE|AUDIBLE\\*|AUDIBLE.COM" }, "set": { "payee": "Audible", "category_id": "personal.shopping.books" }, "samples": ["Audible*AB12CD34E", "AUDIBLE.COM"] },
  { "id": "amazon.whole_foods", "match": { "description": "WHOLE FOODS|WHOLEFDS" }, "set": { "payee": "Whole Foods", "category_id": "personal.groceries" }, "samples": ["WHOLEFDS ABC 10123", "Whole Foods Market"] },
  { "id": "amazon.fresh", "match": { "description": "AMAZON FRESH|AMZN FRESH" }, "set": { "payee": "Amazon Fresh", "category_id": "personal.groceries" }, "samples": ["Amazon Fresh*AB1CD2EF3"] },
  { "id": "amazon.web_services", "match": { "description": "AMAZON WEB SERVICES|AWS.AMAZON|^AWS" }, "set": { "payee": "Amazon Web Services", "category_id": "business.office_expenses.web_services" }, "samples": ["Amazon Web Services aws.amazon.co", "AWS EMEA"] },
  { "id": "amazon", "match": { "description": "AMAZON|AMZN" }, "set": { "payee": "Amazon", "category_id": "personal.shopping" }, "samples": ["AMAZON MKTPL*AB12CD34E", "Amazon.com*XY9Z8W7V6", "AMZN Mktp US*1A2B3C"] },

  { "id": "netflix", "match": { "description": "NETFLIX" }, "set": { "payee": "Netflix", "category_id": "personal.shopping.streaming_service" }, "samples": ["NETFLIX.COM"] },
  { "id": "hulu", "match": { "description": "^HULU|HULU.COM|HULU\\*" }, "set": { "payee": "Hulu", "category_id": "personal.shopping.streaming_service" }, "samples": ["HULU 877-8244858", "Hulu"] },
  { "id": "disney.plus", "match": { "description": "DISNEY PLUS|DISNEYPLUS|DISNEY+" }, "set": { "payee": "Disney+", "category_id": "personal.shopping.streaming_service" }, "samples": ["DISNEY PLUS 888-9054000", "Disney+"] },
  { "id": "max", "match": { "description": "HBO MAX|HBOMAX|MAX.COM" }, "set": { "payee": "Max", "category_id": "personal.shopping.streaming_service" }, "samples": ["MAX.COM", "HBO MAX"] },
  { "id": "peacock", "match": { "description": "PEACOCK TV|PEACOCKTV|PEACOCK PREMIUM|^PEACOCK$" }, "set": { "payee": "Peacock", "category_id": "personal.shopping.streaming_service" }, "samples": ["PEACOCK PREMIUM", "Peacock"] },
  { "id": "paramount.plus", "match": { "description": "PARAMOUNT+|PARAMOUNT PLUS|PARAMOUNTPLUS" }, "set": { "payee": "Paramount+", "category_id": "personal.shopping.streaming_service" }, "samples": ["Paramount+", "PARAMOUNT PLUS"] },
  { "id": "espn.plus", "match": { "description": "ESPN+|ESPN PLUS" }, "set": { "payee": "ESPN+", "category_id": "personal.shopping.streaming_service" }, "samples": ["ESPN PLUS", "ESPN+"] },
  { "id": "sling.tv", "match": { "description": "SLING.COM|SLING TV" }, "set": { "payee": "Sling TV", "category_id": "personal.shopping.streaming_service" }, "samples": ["SLING.COM", "SLING TV"] },
  { "id": "youtube.premium", "match": { "description": "YOUTUBE PREMIUM|YOUTUBEPREMIUM" }, "set": { "payee": "YouTube Premium", "category_id": "personal.shopping.streaming_service" }, "samples": ["Google YouTubePremium", "YOUTUBE PREMIUM"] },
  { "id": "youtube.tv", "match": { "description": "YOUTUBE TV|YOUTUBETV" }, "set": { "payee": "YouTube TV", "category_id": "personal.shopping.streaming_service" }, "samples": ["Google YouTubeTV", "YOUTUBE TV"] },
  { "id": "spotify", "match": { "description": "SPOTIFY" }, "set": { "payee": "Spotify", "category_id": "personal.shopping.streaming_service" }, "samples": ["Spotify USA"] },
  { "id": "siriusxm", "match": { "description": "SIRIUSXM|SIRIUS XM|SIRIUS RADIO" }, "set": { "payee": "SiriusXM", "category_id": "personal.shopping.streaming_service" }, "samples": ["SIRIUSXM RADIO", "SIRIUS XM"] },

  { "id": "uber.driver_pay", "match": { "description": "RASIER|^UBER USA*EDI P", "direction": "in", "account_types": ["bank"] }, "set": { "payee": "Uber", "category_id": "business.business_income" }, "samples": ["RASIER 6795 EDI PAYMNT", "UBER USA 6787 EDI PAYMNT"] },
  { "id": "uber.eats", "match": { "description": "UBER EATS|UBEREATS|UBER \\*EATS|UBER\\* EATS|UBER\\*EATS" }, "set": { "payee": "Uber Eats", "category_id": "personal.dining_drinks.food_delivery" }, "samples": ["UBER *EATS PENDING", "UBER* EATS", "Uber Eats"] },
  { "id": "uber.one", "match": { "description": "UBER ONE" }, "set": { "payee": "Uber One", "category_id": "personal.shopping.membership_fees" }, "samples": ["UBER ONE MEMBERSHIP"] },
  { "id": "uber", "match": { "description": "^UBER" }, "set": { "payee": "Uber", "category_id": "personal.auto_transport.rideshare" }, "samples": ["UBER *TRIP HELP.UBER.COM", "Uber"] },
  { "id": "waymo", "match": { "description": "WAYMO" }, "set": { "payee": "Waymo", "category_id": "personal.auto_transport.rideshare" }, "samples": ["WAYMO LLC"] },
  { "id": "tesla.robotaxi", "match": { "description": "ROBOTAXI|CYBERCAB" }, "set": { "payee": "Tesla Robotaxi", "category_id": "personal.auto_transport.rideshare" }, "samples": ["TESLA ROBOTAXI"] },
  { "id": "zoox", "match": { "description": "ZOOX" }, "set": { "payee": "Zoox", "category_id": "personal.auto_transport.rideshare" }, "samples": ["ZOOX RIDE"] },
  { "id": "lyft", "match": { "description": "LYFT", "direction": "out" }, "set": { "payee": "Lyft", "category_id": "personal.auto_transport.rideshare" }, "samples": ["LYFT *RIDE TUE 5PM", "Lyft"] },
  { "id": "doordash", "match": { "description": "DOORDASH", "direction": "out" }, "set": { "payee": "DoorDash", "category_id": "personal.dining_drinks.food_delivery" }, "samples": ["DD *DOORDASH NOODLEHOU"] },
  { "id": "grubhub", "match": { "description": "GRUBHUB" }, "set": { "payee": "Grubhub", "category_id": "personal.dining_drinks.food_delivery" }, "samples": ["GRUBHUB*TACOSPOT"] },
  { "id": "instacart", "match": { "description": "INSTACART" }, "set": { "payee": "Instacart", "category_id": "personal.groceries" }, "samples": ["INSTACART*SUBSCRIPTION", "Instacart"] },

  { "id": "trader_joes", "match": { "description": "TRADER JOE" }, "set": { "payee": "Trader Joe's", "category_id": "personal.groceries" }, "samples": ["TRADER JOE S #123", "Trader Joe's"] },
  { "id": "aldi", "match": { "description": "^ALDI" }, "set": { "payee": "Aldi", "category_id": "personal.groceries" }, "samples": ["ALDI 12345"] },
  { "id": "starbucks", "match": { "description": "STARBUCKS" }, "set": { "payee": "Starbucks", "category_id": "personal.dining_drinks.coffee_shops" }, "samples": ["STARBUCKS STORE 01234"] },
  { "id": "dunkin", "match": { "description": "DUNKIN" }, "set": { "payee": "Dunkin'", "category_id": "personal.dining_drinks.coffee_shops" }, "samples": ["DUNKIN #345678"] },
  { "id": "mcdonalds", "match": { "description": "MCDONALD" }, "set": { "payee": "McDonald's", "category_id": "personal.dining_drinks.fast_food" }, "samples": ["MCDONALD'S F12345"] },
  { "id": "chipotle", "match": { "description": "CHIPOTLE" }, "set": { "payee": "Chipotle", "category_id": "personal.dining_drinks.fast_food" }, "samples": ["CHIPOTLE 1234"] },
  { "id": "taco_bell", "match": { "description": "TACO BELL" }, "set": { "payee": "Taco Bell", "category_id": "personal.dining_drinks.fast_food" }, "samples": ["TACO BELL #031234"] },
  { "id": "in_n_out", "match": { "description": "IN-N-OUT|IN N OUT" }, "set": { "payee": "In-N-Out", "category_id": "personal.dining_drinks.fast_food" }, "samples": ["IN-N-OUT BURGER 123"] },

  { "id": "home_depot", "match": { "description": "HOME DEPOT" }, "set": { "payee": "The Home Depot", "category_id": "personal.home.home_improvement" }, "samples": ["THE HOME DEPOT #1234"] },
  { "id": "lowes", "match": { "description": "^LOWE'S|^LOWES" }, "set": { "payee": "Lowe's", "category_id": "personal.home.home_improvement" }, "samples": ["LOWE'S #1234", "LOWES #01234"] },
  { "id": "cvs", "match": { "description": "^CVS" }, "set": { "payee": "CVS", "category_id": "personal.health.pharmacy" }, "samples": ["CVS/PHARMACY #01234"] },
  { "id": "walgreens", "match": { "description": "WALGREENS" }, "set": { "payee": "Walgreens", "category_id": "personal.health.pharmacy" }, "samples": ["WALGREENS #1234"] },
  { "id": "rite_aid", "match": { "description": "RITE AID" }, "set": { "payee": "Rite Aid", "category_id": "personal.health.pharmacy" }, "samples": ["RITE AID STORE 1234"] },
  { "id": "medicare", "match": { "description": "CMS MEDICARE|MEDICARE.GOV", "direction": "out" }, "set": { "payee": "Medicare", "category_id": "personal.health.medicare_part_a_b" }, "samples": ["CMS MEDICARE PREMIUMS", "CMS MEDICARE"] },
  { "id": "medicare.part_d", "match": { "description": "MEDICARE PART D|MEDICARE RX|MEDICARERX", "direction": "out" }, "set": { "category_id": "personal.health.medicare_part_d" }, "samples": ["ACME MEDICARE PART D", "ACME MEDICARE RX", "ACME MEDICARERX PREMIUM"] },
  { "id": "medigap", "match": { "description": "MEDIGAP|MEDICARE SUPP", "direction": "out" }, "set": { "category_id": "personal.health.medigap" }, "samples": ["ACME MEDIGAP PLAN G", "ACME MEDICARE SUPPLEMENT"] },
  { "id": "planet_fitness", "match": { "description": "PLANET FITNESS" }, "set": { "payee": "Planet Fitness", "category_id": "personal.fitness.gym" }, "samples": ["PLANET FITNESS CLUB FEES"] },

  { "id": "verizon.fios", "match": { "description": "VERIZON FIOS|FIOS INTERNET|FIOS TV|^FIOS" }, "set": { "payee": "Verizon Fios", "category_id": "personal.utilities.internet_cable" }, "samples": ["VERIZON FIOS BILL PAY", "FIOS INTERNET"] },